[
  {
    "id": "arsenal-visit-rwanda-2026",
    "year": 2026,
    "clubId": "arsenal",
    "sponsorId": "visit-rwanda",
    "what": "Dropped Visit Rwanda",
    "text": "Off the sleeve after eight seasons. Fans had spoken up about it for years.",
    "source": {
      "name": "SportsPro (citing The Athletic)",
      "date": "2026-07-15",
      "url": "https://www.sportspro.com/news/sponsorship-marketing/aston-villa-visit-rwanda-shirt-principal-sponsorship-july-2026/"
    },
    "featured": true
  },
  {
    "id": "newcastle-sela-2026",
    "year": 2026,
    "clubId": "newcastle-united",
    "sponsorId": "sela",
    "what": "Dropped Sela",
    "text": "The Saudi state-owned events company is off the front of the shirt. A drinks brand replaces it.",
    "source": {
      "name": "The Mag",
      "date": "2026-06",
      "url": "https://www.themag.co.uk/2026/06/newcastle-united-have-agreed-new-main-sponsor-front-of-shirt-three-year-deal-to-replace-sela/"
    },
    "featured": true
  },
  {
    "id": "bayern-visit-rwanda-2025",
    "year": 2025,
    "clubId": "bayern-munich",
    "sponsorId": "visit-rwanda",
    "what": "Stepped back from Visit Rwanda",
    "text": "Moved away from the Visit Rwanda branding after criticism, two years after ending Qatar Airways.",
    "source": {
      "name": "Deutsche Welle, Bayern Munich end Rwanda sponsorship after pressure",
      "date": "2025-08",
      "url": "https://www.dw.com/en/bayern-munich-end-rwanda-sponsorship-after-pressure/a-73574184",
      "note": "The club ended the commercial deal with the Rwanda Development Board after fan and media pressure."
    },
    "featured": true
  },
  {
    "id": "bayern-qatar-airways-2023",
    "year": 2023,
    "clubId": "bayern-munich",
    "sponsorId": "qatar-airways",
    "what": "Dropped Qatar Airways",
    "text": "Members raised it at meetings and in the stands for years. The deal was not renewed.",
    "source": {
      "name": "Deutsche Welle, Bayern Munich end Qatar deal after fan pressure",
      "date": "2023",
      "url": "https://www.dw.com/en/football-bayern-munich-end-qatar-deal-after-fan-pressure/a-63418536",
      "note": "Deal ended by mutual agreement on 30 June 2023 after five years."
    },
    "featured": true
  },
  {
    "id": "schalke-gazprom-2022",
    "year": 2022,
    "clubId": "schalke-04",
    "sponsorId": "gazprom",
    "what": "Dropped Gazprom",
    "text": "Took the logo off the shirt within days, then ended a 15-year deal early.",
    "source": {
      "name": "RFE/RL",
      "date": "2022-03",
      "url": "https://www.rferl.org/a/gazprom-uefa-ferencvaros-hungary-soccer-ukraine-war-schalke/32941442.html",
      "note": "Schalke cut ties at the same time as UEFA, ending a 15-year front-of-shirt deal."
    },
    "featured": true
  },
  {
    "id": "manutd-aeroflot-2022",
    "year": 2022,
    "clubId": "manchester-united",
    "sponsorId": "aeroflot",
    "what": "Dropped Aeroflot",
    "text": "Ended the deal early and said it shared fans’ concerns.",
    "source": {
      "name": "ESPN",
      "date": "2022-02-25",
      "url": "https://www.espn.com/soccer/story/_/id/37625797/man-united-cut-sponsorship-russian-airline-aeroflot-amid-ukraine-invasion",
      "note": "United withdrew Aeroflot's sponsorship rights and said it shared fans' concerns."
    },
    "featured": true
  },
  {
    "id": "wwc-visit-saudi-2023",
    "year": 2023,
    "clubId": null,
    "orgName": "Women’s World Cup (FIFA)",
    "leagueId": "fifa",
    "sponsorId": "visit-saudi",
    "what": "Dropped Visit Saudi",
    "text": "Talks abandoned after players and the host federations objected.",
    "source": {
      "name": "The Guardian, FIFA admits defeat over Saudi sponsorship of Women's World Cup",
      "date": "2023-03-16",
      "url": "https://www.theguardian.com/football/2023/mar/16/fifa-defeat-saudi-sponsorship-womens-world-cup-plans-infantino"
    },
    "featured": false
  },
  {
    "id": "uefa-gazprom-2022",
    "year": 2022,
    "clubId": null,
    "orgName": "UEFA",
    "leagueId": "uefa",
    "sponsorId": "gazprom",
    "what": "Dropped Gazprom",
    "text": "Ended across the Champions League, national-team competitions and Euro 2024.",
    "source": {
      "name": "The Athletic, UEFA ends partnership with Gazprom",
      "date": "2022-02-28",
      "url": "https://www.nytimes.com/athletic/4181788/2022/02/28/uefa-ends-partnership-with-russian-energy-company-gazprom/"
    },
    "featured": false
  },
  {
    "id": "haas-uralkali-2022",
    "year": 2022,
    "clubId": null,
    "orgName": "Haas F1 Team",
    "leagueId": "formula-1",
    "sponsorId": "uralkali",
    "what": "Dropped Uralkali",
    "text": "Title sponsorship with the Russian fertiliser company ended right after the invasion of Ukraine.",
    "source": {
      "name": "ESPN, Haas terminates contracts with Mazepin and Uralkali",
      "date": "2022-03-05",
      "url": "https://www.espn.com/f1/story/_/id/33419710/haas-terminates-contracts-russian-driver-nikita-mazepin-title-sponsor-uralkali"
    },
    "featured": false
  },
  {
    "id": "f1-russian-gp-2022",
    "year": 2022,
    "clubId": null,
    "orgName": "Formula 1",
    "leagueId": "formula-1",
    "sponsorId": null,
    "what": "Cancelled the Russian Grand Prix",
    "text": "Race cancelled, then the promoter contract terminated.",
    "source": {
      "name": "Sky Sports, Formula 1 terminates Russian GP contract",
      "date": "2022-03-03",
      "url": "https://www.skysports.com/f1/news/12433/12556381/formula-1-terminates-russian-gp-contract-in-wake-of-ukraine-invasion"
    },
    "featured": false
  }
]
